vakstrarmatrix Ansoff	talva, ið hevur tveir faktorar: vøru og marknað, sum síðani eru býtt sundur í verandi og nýtt; á tann hátt hevur talvan 4 strategiir:marknaðarpenetreringvið verandi vøru á verandi marknaði,marknaðarmenningvið verandi vørum á nýggjum marknaði,vørumenningvið nýggjum vørum á verandi marknaði, ogdiversifikatiónvið nýggjum vørum á nýggjum marknaði
vakstrarstrategi	um virki hevur sum mál at vaksa, kann valið vera millum fleiri strategiir, til dømis at økja um søluna av verandi vørum ella tænastum á verandi marknaði, at menna nýggjar vørur ella tænastur, at fara inn á nýggjar marknaðir ella at velja eina samanseting av fleiri strategium
VALS-myndilin	value and lifestyle; amboð, ið býtir kundar sundur eftir lívsstílum, og verður nýtt ísegmenteringav marknaði
valutapolitikkur	virði á einum gjaldoyra verður til sum úrslit av útboði og eftirspurningi; lond við egnum gjaldoyra ávirka meira og minni útboð ella eftirspurning fyri at forða fyri ov stórum sveiggjum í kursinum; eisini kemur fyri, at lond niðurskriva ella uppskriva gjaldoyrað fyri at ávirka gjaldsjavnan ella onnur samfelagsbúskaparlig mál; sídevalueringogrevaluering
valuti	gjaldoyra í londum, sum ikki hava sama gjaldoyra sum vit
vanakeyp	tað, at nýtsluvanar og keypsvanar ráða, tá ið keyparin ger av, hvat hann skal keypa; síbráðkeypogtillagað endurkeyp
varaseting	substitutión; tað, at ein framleiðslufaktorur kann verða nýttur í staðin fyri ein annan; síisokvantkurvaogisokostlinja
varsemi	hugtak í roknskaparpraksis; varsemisreglan verður ofta nýtt at viðgera óvissuna, sum er í arbeiðnum við ársroknskapi, og varð fyrr mett sum ein neyðug mótvekt ímóti optimismu millum leiðarar og eigarar og sum ein forðing fyri, at ov nógv bleiv goldið út sumvinningsbýti
varsemisendamál	at hava pening tøkan við tí endamáli at kunna standa ímóti óvæntaðum hendingum; sígjaldingarendamálogspekulatiónsendamál
váði	hugtak fyri ta óvissu, sum er í sambandi við íløgur, tí tað er ilt at siga, hvat fer at henda í framtíðini
veblen effekt	sosial keypsorsøk; tað, at ein vøra verður keypt fyri at vísa øðrum, at keyparin hevur ráð; tað er tí ein treyt, at vøran er kend fyri at vera dýr
veð	ogn, ið er veitt sum trygd fyri lán
veðbræv	skuldarbræv, ið skuldari skrivar, tá ið hann hevur sett fasta ogn ellaleysafæíveðfyri skuldina
veðhaldslán	lán, sum ognir eru settar íveðfyri sum trygd
veðhavi	ein, ið hevur veitt lán við trygd í ogn, sum er sett íveð
veðrættur	rættur hjá veðhava til ogn, sum er sett íveð
veðsetari	ein, ið hevur sett ogn íveð
veikleikar í lyklatølum	innbygdir veikleikar í lyklatølum eru til dømis íognaravkastinum, sum er ávirkað avavskrivingum í bæði teljara og nevnara; aðrir veikleikar eru, um lyklatølini erustatisk
veitingarjavni	uppgerð, ið vísir alla tilgongd av vørum og tænastum í landinum, og hvat henda tilgongd er farin til; tilgongd erbruttotjóðarúrtøka(BTÚ) oginnflutningur, og tilgongdin ernýtsla,íløgur ellaútflutningur
veitingarketa	keta, har einstøku liðini eru veitarar av rávøru og lutum, framleiðarar av vøruni, heilsølur og smásølur, ið arbeiða saman um at nøkta ein tørv hjá brúkaranum; tey einstøku liðini geva hvørt sær eitt íkast til, at brúkarin gerst nøgdur
veitingarstrategi	avgerð um, hvørjar vørur eitt virki skal gera sjálvt, hvørjar tað skal keypa, og hvussu tætt tað skal samarbeiða við veitarar av vørum
veiting sum inntøkutreyt	veiting er tann mest vanliga inntøkutreytin í roknskapi, tí at inntøkan verður roknað, tá ið vøran skiftir eigara; sí bílegging,framleiðsla,gjaldingogtrygd
verjumekanismur	sálarligar tilgongdir, sum verja ímóti frustratiónum og vónbrotum, til dømisundanførsla,endurbótogburturtreinging; hevur týdning í sambandi við einstaklingin í fyriskipanini
verkbann	tað, at arbeiðsgevarar nokta fólki at koma til arbeiðis; verkbann kemur fyri, tá ið eingin sáttmáli er, og samráðingar um nýggjan sáttmála eru steðgaðar; síverkfall
verkfall	tað, at arbeiðsfólk leggja arbeiði niður; verkfall kemur fyri, tá ið eingin sáttmáli er, og samráðingar um nýggjan sáttmála eru steðgaðar; síverkbann
verkætlananarfyriskipan	ein tíðaravmarkað fyriskipan í fyriskipanini, tá ið talan er um serstaka uppgávu, ið krevur serkøna vitan í virkinum og uttaneftir; símatrixfyriskipan
vertikal integratión	tað at økja um virksemi við at fara inn á onnur lið í veitingarketuni, antin aftureftir, har veitararnir eru, ella frameftir, har kundarnir eru; síhorisontal integratión
viðkomandi kostnaður	í íløgurokning: kostnaður, ið broytist av íløguavgerð, og skal tí takast við í útrokningarnar; síóviðkomandi kostnaður
viðkvæmi	sí prísviðkvæmi,innkomuviðkvæmiogviðkvæmisgreining
viðkvæmisgreining	ein greining at meta um óvissuna við einari møguligari íløgu; greiningin skal lýsa, hvussu viðkvom einíløgaer fyri broytingum í fortreytunum
viðlíkahaldsfaktorar	sírøktarfaktorar
vinningsbýti	tað, sum verður goldið partaeigarum í einum partafelagi av avlopinum eftir skatt
vinningsbýti pr. partabræv	partabrævalyklatal: vinningsbýti/tal á partabrøvum
vinningsbýtisavkast	partabrævalyklatal: vinningsbýti/marknaðarvirði á partabrøvunum
vinningsbýtisdekningur	partabrævalyklatal: vinningur eftir skatt/vinningsbýti
vinningsbýtispartur	partabrævalyklatal: vinningsbýti/vinningur eftir skatt
vinningsføri	evni hjá virki at fáa vinning burtur úr virkseminum; síbruttoavkastograkstraravkast
vinningur pr. partabræv	partabrævalyklatal: vinningur eftir skatt/tal á partabrøvum
vinnubræv	loyvi frá fútanum at hava virki í ávísari kommunu
vinnugrein	partur av vinnulívinum, sum arbeiðir við sama slagi av vørum ella tænastum; vanliga verður vinnulívið býtt sundur í 9 høvuðsflokkar, sum aftur eru býttir sundur í nógvar vinnugreinir
vinnugrundarlag	síhugsjónarligt grundarlag
vinnuligur fiskiskapur	fiskiskapur við tí fyri eyga at fáa vinning til manning og reiðarí; heitið verður nýtt í lógum og reglum, sum ikki eru galdandi fyri fiskiskap til egið húsarhald
vinnupolitikkur	tað, at myndugleikar seta tiltøk í verk at broyta korini hjá vinnuligum virkjum; til dømis at stuðla gransking og útflutningi, veita lagalig lán og annað
vinnurekandi grunnur	sígrunnur
vinnuskifting	yvirlit, ið vísir, hvussu fólk í arbeiði eru skift millumfyrstalagsvinnu,annaðlagsvinnu ogtriðjalagsvinnu
virðisbræv	skjal, ið prógvar rættin til pening, ella prógvar ognarrætt í virki, til dømispartabrævogskuldarbræv
virðisbrævamarknaður	marknaður, har virðisbrøv verða umsett; til dømis Kauphöll Íslands, Københavns Fondsbørs, Oslo Børs og NYSE
Virðisbrævamarknaður Føroya	føroyskur virðisbrævamarknaður, ið varð stovnaður í 2000, og niðurlagdur í 2014
virðisfatan	hugburður um, hvat er virðismikið í tilveruni; hetta hevur týdning fyrivirkismentan
virðisgrundað ástøði	roknskaparástøði, sum leggur dent á fíggjarstøðuna, og síðani verður úrslitið ásett eftir tí; síavriksgrundað ástøði
virðisketa	hugtak, ið verður nýtt at skilja, hvussu virðisøking fer fram í virkinum; virðisketan lýsir virksemi í og uttan um virkið; virðið, sum verður til, hongur saman við tí prísi, sum virkið kann krevja fyri vøruna ella tænastuna, og tí prísi, sum tað kostar virkinum at gera ella útvega vøruna ella tænastuna
virðismeting	eitt týðandi evni í roknskapi, sum kann hava stóran týdning fyriúrslitogeginkapital; sí goymsluvirði,avskriving,niðurskriving,bókað virðioguppskriving
virðistollur	tollur, ið verður roknaður eftirtollvirði; síeindartollur
virki	búskaparlig eind, ið selur vørur ella tænastur
virkisbúskapur	vitan um tað at stýra fyritøkum búskaparliga; síbúskaparstýring
virkisformur	formligur karmur um eigaraviðurskiftini í einum virki; til dømiseinstaklingsvirki,íognarfelag,smápartafelagogpartafelag
virkisgrundarlag	síhugsjónarligt grundarlag
virkishugskot	hugskot um, hvat eitt virki ætlar at gera, hvønn tað ætlar at selja til, og hvønn tørv hetta nøktar; er virkishugskotið burðardygt, verður tað hugsjónarliga grundarlagið hjá virkinum
virkiskonsept	lýsing av einum virki, tí, sum tað selur, og marknaðinum
virkismarknaður	marknaður, har bæði seljarar og keyparar eru virki ella stovnar; virkismarknaður kann vera býttur sundur íídnaðarmarknað,millumhandlaramarknaðogstovnsmarknað; síbrúkaramarknaður
virkismentan	virði, sjónarmið, hugburður og siðvenja í einum virki; saman við bygnaði og tilgongdum er virkismentanin ein týðandi táttur í fyriskipanini
virksemisstýring	tann parturin av fíggjarligu stýringini, sum snýr seg um sølu, marknað og søluætlanir; síkapasitetsstýringogfíggingarstýring
virksemisætlan	sísøluætlan
visión	hugsjón um, hvar ein fyritøka vónar at vera um til dømis 10 ár
vitanarroknskapur	lýsing av, hvat eitt virki ger fyri at útvega, menna og hava ta vitan, sum skal til fyri at klára seg í framtíðini; hetta snýr seg um, hvat virkið ætlar, og hvat tað skal duga væl fyri at kunna veita dygargóðar vørur og tænastur
víð kapping	kapping millum ymisk vørusløg og ymiskar tænastur, ið nøkta ymiskan tørv hjá brúkarum; sítrong kapping,sertokkiogskotskivumyndilin
vísindaligvirkisleiðsla	klassisk fyriskipan, ið hevði sum eyðkenni, at alt skuldi kannast og greinast vísindaliga, áðrenn tað varð sett í verk; síbureaukratiski skúlinogfyrisitingarligi skúlin
vísital	eitt virði á einari stødd í einum ári sum prosent av virðinum í støðisárinum; um ein stødd er vaksin við 20% frá 2008 til 2010, er vísitalið 120 í 2010 við 2008 sum støðisári
vøra í gerð	postur í roknskapinum, sum vísir virðið á vøru í gerð
vørugoymsla	virði á vøru á goymslu
vøruhugsjón	hugburður um marknaðin, at kundarnir vilja hava tær vørur, ið hava dygd, førleika ella aðrar eginleikar; virkisleiðsla, ið hevur henda hugburð, leggur dent á at gera dygdargóða vøru, sum kundarnir skilja tað og at bøta um dygdina alla tíðina; sí marknaðarhugsjón,framleiðsluhugsjón,søluhugsjón,marknaðarførsluhugsjónogsamfelagshugsjón
vøruhugtakið	tað, sum virki bjóðar at selja á einum marknaði, og sum nøktar ein tørv hjá einum málbólki; vøruhugtakið fevnir ofta bæði um ítøkiligar vørur, tænastuveitingar og hugskot; sígóði
vørukeyp	virði á keyptari vøru í einum tíðarskeiði
vørukonsept	sívøruhugsjón
vørumenning	ávirkingarparametur: at menna ávísa vøru til marknaðin, sum er; sí eisinimarknaðarmenning; útreiðslur til vørumenning kunnu verða ognarførdar í roknskapinum sumimmateriell støðisogn
vørumerki	serligt eyðkenni, sum framleiðari setir á vøruna fyri at skilja vøruna frá vørum av sama slagi; vørumerki kann standa í fíggjarstøðuni sumimmateriall støðisogn
vørunýtsla	kostvirðiá seldari vøru
vøruognarar	tað, sum eitt virki skyldar teimum, ið tað hevur keypt vøru frá
vøru- og tænastujavni	partur av gjaldsjavnanum hjá einum landi, sum vísir inntøkur og útreiðslur av handli við vørum og tænastum; sí gjaldsjavni,handilsjavniogtænastujavni
vøru- og tænastuskuldarar	tað, sum eitt virki eigur á hjá teimum, ið tað hevur selt vørur ella tænastur til
vøruráð	kappingarráð, ið eru grundarlag undir marknaðarførsluni; sígrundparametur
vøruroknskapur	roknskapur við vørusølu, vørunýtslu og bruttovinningi
vøruskuld	sívøruognarar
vøruskuldaraumferð	hugtak í fíggjarligari greining: vørusøla í árinum/ vøruskuldarar; talið sigur, hvussu ofta vøruskuldarar verða umsettir um árið
vøruspjaðing	síyrkisglíðing
vørusøla	seld nøgd av ávísari vøru; søluinntøka í krónum; síumsetningur
